{
  "id": "lm2596-buck-converter",
  "name": "LM2596 DC-DC Buck Converter",
  "manufacturer": "Generic",
  "category": "power",
  "description": "Adjustable step-down voltage regulator, 3A max, 4-40V input, 1.25-37V output",
  "dimensions": {
    "length_mm": 43.0,
    "width_mm": 21.0,
    "height_mm": 14.0,
    "tolerance_mm": 0.5
  },
  "distributors": {
    "amazon": "B07C2QF1T1",
    "aliexpress": "LM2596-buck"
  },
  "features": [
    {
      "feature_type": "potentiometer",
      "name": "Voltage Adjust",
      "description": "Multi-turn potentiometer for output voltage adjustment",
      "position_x_mm": 8.0,
      "position_y_mm": 10.5,
      "position_z_mm": 14.0,
      "hole_width_mm": 5.0,
      "hole_height_mm": 5.0,
      "is_circular": true,
      "required_face": "top",
      "requires_external_access": true
    },
    {
      "feature_type": "cable_entry",
      "name": "Input Terminals",
      "description": "Screw terminals for input power (IN+, IN-)",
      "position_x_mm": 0,
      "position_y_mm": 6.0,
      "position_z_mm": 5.0,
      "hole_width_mm": 4.0,
      "hole_height_mm": 10.0,
      "is_circular": false,
      "required_face": "left",
      "requires_external_access": true
    },
    {
      "feature_type": "cable_entry",
      "name": "Output Terminals",
      "description": "Screw terminals for output power (OUT+, OUT-)",
      "position_x_mm": 43.0,
      "position_y_mm": 6.0,
      "position_z_mm": 5.0,
      "hole_width_mm": 4.0,
      "hole_height_mm": 10.0,
      "is_circular": false,
      "required_face": "right",
      "requires_external_access": true
    },
    {
      "feature_type": "ventilation",
      "name": "Heat Sink Area",
      "description": "Inductor and IC generate heat under load",
      "position_x_mm": 15.0,
      "position_y_mm": 5.0,
      "position_z_mm": 14.0,
      "hole_width_mm": 15.0,
      "hole_height_mm": 12.0,
      "is_circular": false,
      "required_face": "top",
      "requires_external_access": true
    }
  ],
  "mounting": {
    "type": "standoff",
    "holes": [
      {"x": 2.5, "y": 2.5, "diameter": 3.0},
      {"x": 40.5, "y": 2.5, "diameter": 3.0},
      {"x": 2.5, "y": 18.5, "diameter": 3.0},
      {"x": 40.5, "y": 18.5, "diameter": 3.0}
    ]
  },
  "added_by": "system",
  "added_date": "2026-01-26",
  "verified": true
}
